ID,English,Japanese,Primary,Secondary,Evolves into,Notes
144,Articuno,Furīzā (フリーザー),Ice,Flying,No evolution,"Part of the Legendary Birds. The naming conventions for this trio are based on their type - Artic, Zap and Molt - along with a 1, 2, 3 in Spanish - uno, dos, tres. As it flies, snow drifts from its wings."
145,Zapdos,Sandā (サンダー),Electric,Flying,No evolution,Part of the Legendary Birds. Design inspired by the Indigenous North American myth of the thunderbird.[17]
146,Moltres,Faiyā (ファイヤー),Fire,Flying,No evolution,Part of the Legendary Birds. Design inspired by the firebird of Slavic folklore.[17]
147,Dratini,Miniryū (ミニリュウ),Dragon,,Dragonair (#148),Its existence was unknown until a fisherman pulled it up after fishing for 10 hours straight.
148,Dragonair,Hakuryū (ハクリュー),Dragon,,Dragonite (#149),
149,Dragonite,Kairyū (カイリュー),Dragon,Flying,End of evolution,Pseudo-Legendary. It zooms off over seas to challenge other Pokemon.
150,Mewtwo,Myūtsū (ミュウツー),Psychic,,Two Mega Evolutions,"Legendary. One of the playable characters in Super Smash Bros. Melee, Super Smash Bros. for Nintendo 3DS / Wii U and Super Smash Bros. Ultimate. Its genes were spliced and restructured from Mew's. However, its attutude is far more vile that it. Plus some say its the strongest Pokemon out there, but no one can say for sure."
151,Mew,Myū (ミュウ),Psychic,,No evolution,Only available through Nintendo events. It can turn invisible at will and it can turn into anything at will.
0,MissingNo.,Ketsuban (けつばん),Bird[nb 9],Normal,No evolution,"An error handler species, ""Missing Number"" was created to handle attempts at accessing nonexistent Pokémon species.[59][60] It is regarded as one of the most famous and popular glitches in video game history.[61]"