ID,English,Japanese,Primary,Secondary,Evolves into,Notes
1,Bulbasaur,Fushigidane (フシギダネ),Grass,Poison,Ivysaur (#002),"Reception to Bulbasaur has been largely positive and it often appears in ""top Pokémon lists"".[3][4] Its English name is a portmanteau of ""bulb"" and ""dinosaur"".[5] It shares its category with Ivysaur, Venusaur and Sunkern. They are all known as the Seed Pokémon."
2,Ivysaur,Fushigisō (フシギソウ),Grass,Poison,Venusaur (#003),"Playable character in Super Smash Bros. Brawl and Super Smash Bros. Ultimate as a part of the ""Pokémon Trainer"" fighter. Its English name is a portmanteau of ""ivy"" and ""dinosaur"".[6]"
3,Venusaur,Fushigibana (フシギバナ),Grass,Poison,Mega Evolution,"Its English name is a portmanteau of ""Venus"" (relating to the Venus flytrap) and ""dinosaur"". It is the mascot of Pokémon Green and LeafGreen.[7] It is based on the Pareiasaur."
4,Charmander,Hitokage (ヒトカゲ),Fire,,Charmeleon (#005),"Charmander is a bipedal, salamander-like creature with a flame at the tip of its tail. Its English name is a portmanteau of ""char"" and ""salamander"".[8]"
5,Charmeleon,Rizādo (リザード),Fire,,Charizard (#006),"Charmeleon shares a nearly identical design to Charmander, though is larger in stature. Its English name is a portmanteau of ""char"" and ""chameleon"".[9]"
6,Charizard,Rizādon (リザードン),Fire,Flying,Two Mega Evolutions,"[Gigantamax] Playable character as a part of the ""Pokémon Trainer"" fighter in Super Smash Bros. Brawl and Super Smash Bros. Ultimate, as well as a standalone fighter in Super Smash Bros. for Nintendo 3DS and Wii U. Its English name is a portmanteau of ""char"" and ""lizard"".[10] Its Gigantamax Form has literal fire for wings and has fire coming out of its body. Mascot of Pokémon Red and FireRed."
7,Squirtle,Zenigame (ゼニガメ),Water,,Wartortle (#008),"Playable character in Super Smash Bros. Brawl and Super Smash Bros. Ultimate as a part of the ""Pokémon Trainer"" fighter. Its English name is a portmanteau of ""squirt"" and ""turtle"".[11]"
8,Wartortle,Kamēru (カメール),Water,,Blastoise (#009),"Its English name is a portmanteau of ""war"", ""tortoise"" and ""turtle"".[12]"
9,Blastoise,Kamekkusu (カメックス),Water,,Mega Evolution,"Its English name is a portmanteau of ""blast"" and ""tortoise"". Mascot of Pokémon Blue.[13]"
10,Caterpie,Kyatapī (キャタピー),Bug,,Metapod (#011),"To avoid predators, it releases an odor that makes bird Pokémon think twice about going after it."
11,Metapod,Toranseru (トランセル),Bug,,Butterfree (#012),"It tries to move as little as possible because if its fragile body broke, its liquid guts would spill out, killing it."
12,Butterfree,Batafurī (バタフリー),Bug,Flying,End of evolution,"[Gigantamax] If you put pollen out of your window, a Butterfree will come to you. A Gigantamaxed Butterfree can grow a tremendous size with huge light blue wings."
13,Weedle,Bīdoru (ビードル),Bug,Poison,Kakuna (#014),"Its stinger is poisonous so if it finds itself against a foe, it can protect itself for a while."
14,Kakuna,Kokūn (コクーン),Bug,Poison,Beedrill (#015),"Similar to Metapod, it can't really move because it is melting its own body to evolve."
15,Beedrill,Supiā (スピアー),Bug,Poison,Mega Evolution,"Never go near a Beedrill nest because every Beedrill in the nest will angerly swarm you and sting you repeatedly, which is poisonous as well."
16,Pidgey,Poppo (ポッポ),Normal,Flying,Pidgeotto (#017),"The common bird of Kanto, Pidgey is a bird that will go after bug Pokémon until it scurries away."
17,Pidgeotto,Pijon (ピジョン),Normal,Flying,Pidgeot (#018),Pidgeotto was the second Pokémon that Ash Ketchum caught on his journey in the anime.
18,Pidgeot,Pijotto (ピジョット),Normal,Flying,Mega Evolution,A lot of Trainers choose Pidgeot as their Pokémon because of the striking beautiful feathers it has.
19,Rattata,Koratta (コラッタ),Normal,,Raticate (#020),"Criticized as a ""filthy rodent"" by GamesRadar and ""rubbish"" by the Official Nintendo Magazine[14][15] Its teeth grow very long over time, so it has to gnaw on logs, houses, telephone poles and more so it can be quite a pest at times."
20,Raticate,Ratta (ラッタ),Normal,,End of evolution,"Raticate is a rodent that commands the groups of Rattatas to get it food. Like Rattata, it too needs to whittle its teeth down but it does so on harder objects like steel, wood, rocks, fruit, and more."
21,Spearow,Onisuzume (オニスズメ),Normal,Flying,Fearow (#022),
22,Fearow,Onidoriru (オニドリル),Normal,Flying,End of evolution,"Its English name is a portmanteau of ""fear"" and ""sparrow""."
23,Ekans,Ābo (アーボ),Poison,,Arbok (#024),"Its English name is “snake” spelled backwards. Ekans likes to coil itself because if it gets attacked while sleeping, it's all ready to strike at them."
24,Arbok,Ābokku (アーボック),Poison,,End of evolution,"Belonged to Jessie, a member of Team Rocket, for the Kanto, Johto, and a small portion of the Advanced Generation series of the Pokémon anime. The pattern on its chest is different everywhere. It is hard to escape from its coil because its muscles are so strong. Even though its name is Arbok, what it pronounces is ""Char-bok""."
25,Pikachu,Pikachū (ピカチュウ),Electric,,Raichu (#026),"[Gigantamax] Mascot of the Pokémon franchise, as well as Pokémon Yellow and Let's Go, Pikachu! Also playable in every Super Smash Bros. game to date. Gigantamax Pikachu looks like its old sprite from Red and Blue with a glowing whitish tail. It raises its tail to check its surroundings and it sometimes gets struck by lightning in that pose. If Pikachu sees something new, it'll shock it with electricity. When you see blackened marks on the ground, Pikachu mistook its electrical power."
26,Raichu,Raichū (ライチュウ),Electric,,End of evolution,Raichu has an Alola Form that is an Electric/Psychic Type.
27,Sandshrew,Sando (サンド),Ground,,Sandslash (#028),"Sandshrew has an Alola Form that is a Steel/Ice Type. Based on the Chinese pangolin, Sandshrew is known to curl into a ball to defend itself similar to volvation seen in animals."
28,Sandslash,Sandopan (サンドパン),Ground,,End of evolution,Sandslash is a pangolin-like Pokémon Curls up into a spiny ball when threatened. It can roll while curled up to attack or escape. Sandslash has an Alola Form that is a Steel/Ice Type.
29,Nidoran♀,Nidoran♀ (ニドラン♀),Poison,,Nidorina (#030),"It is related to the Nidoran♂ line, and can produce Eggs that contain either Nidoran♀ or Nidoran♂. However, it is the only one of its line that can breed, as Nidorina and Nidoqueen are part of the Undiscovered Egg Group. Both Nidoran's, Nidorina, Nidorino, Poipole, and Naganadel are known as the Poison Pin Pokémon."
30,Nidorina,Nidorīna (ニドリーナ),Poison,,Nidoqueen (#031),"When it's with its friends and family, it doesn't have its toxic horn out. As soon as danger appears, it is ready to fight."
31,Nidoqueen,Nidokuin (ニドクイン),Poison,Ground,End of evolution,"When protecting its young, it gains more strength than normal. Its hide is so strong, not much can hurt it."
32,Nidoran♂,Nidoran♂ (ニドラン♂),Poison,,Nidorino (#033),
33,Nidorino,Nidorīno (ニドリーノ),Poison,,Nidoking (#034),
34,Nidoking,Nidokingu (ニドキング),Poison,Ground,End of evolution,"Based on Baragon from the Godzilla franchise, It usually fights for the family if its offspring are in trouble."
35,Clefairy,Pippi (ピッピ),Fairy[nb 2],,Clefable (#036),"Originally proposed to be joint mascot of the Pokémon franchise alongside Pikachu, but was quickly overshadowed by the latter's popularity[16]"
36,Clefable,Pikushī (ピクシー),Fairy[nb 2],,End of evolution,Clefairy evolves into Clefable when coming contact with a moon stone
37,Vulpix,Rokon (ロコン),Fire,,Ninetales (#038),"When a Vulpix is born, it only has one white tail that splits into 6 if it gets plenty of love from its Trainer or mother."
38,Ninetales,Kyūkon (キュウコン),Fire,,End of evolution,Designs inspired by the nine-tailed fox of East Asian myth.[17]
39,Jigglypuff,Purin (プリン),Normal,Fairy[nb 2],Wigglytuff (#040),Playable in every Super Smash Bros. game to date.
40,Wigglytuff,Pukurin (プクリン),Normal,Fairy[nb 2],End of evolution,It doesn't care if its large eyes gets dust or dirt in them because its eyes are covered in a thin layer of fluid.
41,Zubat,Zubatto (ズバット),Poison,Flying,Golbat (#042),It uses echolocation because it has no eyes.
42,Golbat,Gorubatto (ゴルバット),Poison,Flying,Crobat (#169),"Golbat loves to drink blood, however it sometimes drinks so much that it can't fly."
43,Oddish,Nazonokusa (ナゾノクサ),Grass,Poison,Gloom (#044),"It buries itself in the soil to absorb the nutrients. the more water it drinks, the glossier it becomes."
44,Gloom,Kusaihana (クサイハナ),Grass,Poison,"Vileplume (#045)
Bellossom (#182)","If it senses danger around it, it produces a horrific stench from the leaves on its head. If there isn't, it's fine and the stench goes away."
45,Vileplume,Rafureshia (ラフレシア),Grass,Poison,End of evolution,"Tour guides always say not to go up to any flower in the jungle, no matter how beautiful is because of this reason: it might just be a Vileplume which can spread toxic spores that will leave you sick for days. Vileplume is based on the Rafflesia, the world's smelliest flower."
46,Paras,Parasu (パラス),Bug,Grass,Parasect (#047),"When a Paras eats, its body isn't getting most of the nutrients, the mushrooms on its back are. Those mushrooms can also be used for medicinal purposes."
47,Parasect,Parasekuto (パラセクト),Bug,Grass,End of evolution,"It hollows out trees to absorb its energy. When the tree dies, it will move on to the next. The mushroom has essentially killed it leaving its host to forage for it."
48,Venonat,Konpan (コンパン),Bug,Poison,Venomoth (#049),
49,Venomoth,Morufon (モルフォン),Bug,Poison,End of evolution,
50,Diglett,Diguda (ディグダ),Ground,,Dugtrio (#051),Farmers like to use Digletts to plow the soil for crops to grow plentifully.
51,Dugtrio,Dagutorio (ダグトリオ),Ground,,End of evolution,
52,Meowth,Nyāsu (ニャース),Normal,,Persian (#053),"[Gigantamax] Reoccurring member of Team Rocket in the Pokémon anime series, Meowth loves anything shiny and will steal it if it can. Murkrow and Meowth will loot each other's stash all the time. Gigantamax Meowth is a tall, thin, Japanese version of it with glowing eyes."
53,Persian,Perushian (ペルシアン),Normal,,End of evolution,"Belonging to Giovanni, the leader of Team Rocket in the Pokémon anime series, Persian will sneak up behind a foe so silently by retracting its claws. It will then pounce on them and rip them to shreds."
54,Psyduck,Kodakku (コダック),Water,,Golduck (#055),"When Psyduck's headache gets severe, it unleashes its psychic powers."
55,Golduck,Gorudakku (ゴルダック),Water,,End of evolution,It was almost hunted to extinction by hunters wanting its precious jewel on its forehead.
56,Mankey,Mankī (マンキー),Fighting,,Primeape (#057),"Mankey is a Snub-nosed monkey-like Pokémon that specializes in physical fighting and is very aggressive and short-tempered. When angry, Mankey begins shaking and its breathing turns rough. Its rage peaks quickly, preventing its victim from being able to flee."
57,Primeape,Okorizaru (オコリザル),Fighting,,End of evolution,"Anything can make a Primeape's blood boil. Its not as smart when its really mad, though. However, sometimes it can get so mad, that it can die because it couldn't handle its anger. Primape is based on the Snub-nosed monkey."
58,Growlithe,Gādi (ガーディ),Fire,,Arcanine (#059),A brave and loyal dog Pokémon that will bark and bite to defend its territory from intruders. Growlithe are popular throughout the Pokémon world as both guard dogs and police dogs. They are based on the Ryukyuan Shisa and Japanese Komainu lion-dog statues.
59,Arcanine,Uindi (ウインディ),Fire,,End of evolution,"A fan-favorite Pokémon, Arcanine is among the strongest non-legendary Pokémon and has been described as having ""the mane of a lion ... the stripes of a tiger [and] the speed of a panther.""[18][19][20]"
60,Poliwag,Nyoromo (ニョロモ),Water,,Poliwhirl (#061),"Poliwag is the favorite Pokémon of Satoshi Tajiri, creator of the Pokémon franchise."
61,Poliwhirl,Nyorozo (ニョロゾ),Water,,"Poliwrath (#062)
Politoed (#186)","Poliwhirl is among the most-marketed Pokémon,[21] being used in a line of chewable vitamins as well as a line of toothbrushes.[22][23]"
62,Poliwrath,Nyorobon (ニョロボン),Water,Fighting,End of evolution,Capable of swimming the Pacific Ocean tirelessly.
63,Abra,Kēshii (ケーシィ),Psychic,,Kadabra (#064),"Even when its sleeping, which it does most of its life, it can sense danger. When it is in danger, it will teleport to safety."
64,Kadabra,Yungerā (ユンゲラー),Psychic,,Alakazam (#065),"Kadabra has been the source of various controversies. The symbols on its body have been associated to those used by Nazi Germany's Waffen-SS. Furthermore, in November 2000, Israeli magician Uri Gellar sued Nintendo, claiming Kadabra embodies an unauthorized appropriation of his identity.[24][25][26] However, in 2020, he releases a claim that Nintendo can use Kadabra again."
65,Alakazam,Fūdin (フーディン),Psychic,,Mega Evolution,"Due to its brain being too heavy in its head, it actually uses its psychic power to hold its head up. Its 5000 IQ makes it a very intelligent Pokémon."
66,Machop,Wanrikī (ワンリキー),Fighting,,Machoke (#067),The best thing about Machop is that its muscles never get sore. It can hurl around 100 adult humans before it gets tired.
67,Machoke,Gōrikī (ゴーリキー),Fighting,,Machamp (#068),
68,Machamp,Kairikī (カイリキー),Fighting,,End of evolution,[Gigantamax] It can throw around 1000 punches in two seconds and move mountains with one arm.
69,Bellsprout,Madatsubomi (マダツボミ),Grass,Poison,Weepinbell (#070),
70,Weepinbell,Utsudon (ウツドン),Grass,Poison,Victreebel (#071),"It has a hook on its rear end that it hooks on trees with and sleeps. When it wakes up, it might find itself on the ground because of the wind."
71,Victreebel,Utsubotto (ウツボット),Grass,Poison,End of evolution,
72,Tentacool,Menokurage (メノクラゲ),Water,Poison,Tentacruel (#073),"If Tentacool isn't in the water, it will shrivel up because it is mostly water."
73,Tentacruel,Dokukurage (ドククラゲ),Water,Poison,End of evolution,
74,Geodude,Ishitsubute (イシツブテ),Rock,Ground,Graveler (#075),"Sometimes mistaken as ordinary rocks, people mistakenly step on them resulting in them getting hurt."
75,Graveler,Gorōn (ゴローン),Rock,Ground,Golem (#076),
76,Golem,Gorōnya (ゴローニャ),Rock,Ground,End of evolution,
77,Ponyta,Ponīta (ポニータ),Fire,,Rapidash (#078),Its Galarian form is a Psychic Type.
78,Rapidash,Gyaroppu (ギャロップ),Fire,,End of evolution,"As a popular Pokémon, Rapidash is considered ""universally appealing"" to fans of cute and cool Pokémon alike.[27][28][29][30]"
79,Slowpoke,Yadon (ヤドン),Water,Psychic,"Slowbro (#080)
Slowking (#199)",Slowpoke eats by dipping its tail in the water. Slowpoke tails are quite a delicacy.
80,Slowbro,Yadoran (ヤドラン),Water,Psychic,Mega Evolution,"With Shellder's poison going through its body, it makes it even more spaced out than it already was."
81,Magnemite,Koiru (コイル),Electric,Steel[nb 3],Magneton (#082),"Was a pure Electric Type in the first games, but had the Steel Type added in Gold and Silver."
82,Magneton,Reakoiru (レアコイル),Electric,Steel[nb 3],Magnezone (#462),
83,Farfetch'd,Kamonegi (カモネギ),Normal,Flying,No evolution[nb 4],Farfetch'd is a duck-like Pokémon that has a green onion stalk for a weapon. It battles over stalks and eats them at starving times. It will die over its own stalk and battle for the best stalks.
84,Doduo,Dōdō (ドードー),Normal,Flying,Dodrio (#085),
85,Dodrio,Dōdorio (ドードリオ),Normal,Flying,End of evolution,
86,Seel,Pauwau (パウワウ),Water,,Dewgong (#087),
87,Dewgong,Jugon (ジュゴン),Water,Ice,End of evolution,
88,Grimer,Betobetā (ベトベター),Poison,,Muk (#089),It eats sewer waste for food. Its body is very slippery so it can slip through almost any opening.
89,Muk,Betobeton (ベトベトン),Poison,,End of evolution,
90,Shellder,Sherudā (シェルダー),Water,,Cloyster (#091),
91,Cloyster,Parushen (パルシェン),Water,Ice,End of evolution,
92,Gastly,Gōsu (ゴース),Ghost,Poison,Haunter (#093),Hides under structures to stop the wind from blowing away its gaseous matter.
93,Haunter,Gōsuto (ゴースト),Ghost,Poison,Gengar (#094),
94,Gengar,Gengā (ゲンガー),Ghost,Poison,Mega Evolution,"[Gigantamax] Owing to its simplistic yet appealing design, Gengar is Ken Sugimori's favorite Pokémon as of the release of X and Y.[31]"
95,Onix,Iwāku (イワーク),Rock,Ground,Steelix (#208),"Though its design has been praised, critics deem Onix underpowered compared to other rock-types of its generation.[1][32][33][34]"
96,Drowzee,Surīpu (スリープ),Psychic,,Hypno (#097),"Drowzee is based on the dream-eating Tapir, Baku."
97,Hypno,Surīpā (スリーパー),Psychic,,End of evolution,"Hypno is based on the dream-eating Tapir, Baku."
98,Krabby,Kurabu (クラブ),Water,,Kingler (#099),
99,Kingler,Kingurā (キングラー),Water,,End of evolution,[Gigantamax]
100,Voltorb,Biriridama (ビリリダマ),Electric,,Electrode (#101),Voltorb and Electrode are some of the least popular Pokémon because of their Pokéball-inspired designs.
101,Electrode,Marumain (マルマイン),Electric,,End of evolution,
102,Exeggcute,Tamatama (タマタマ),Grass,Psychic,Exeggutor (#103),
103,Exeggutor,Nasshī (ナッシー),Grass,Psychic,End of evolution,"A coconut tree-like Pokémon based on the Jinmenju and the favorite Pokémon of Tsunekazu Ishihara, president and CEO of The Pokémon Company, having used it throughout the debugging phase of Pokémon Red and Green."
104,Cubone,Karakara (カラカラ),Ground,,Marowak (#105),The stains on its skull are caused by the tears it sheds knowing it will never see its mother again.
105,Marowak,Garagara (ガラガラ),Ground,,End of evolution,Marowak has an Alola Form that is a Ghost/Fire type.
106,Hitmonlee,Sawamurā (サワムラー),Fighting,,End of evolution,"Hitmonlee's design is based on Headless men, from Greco-Roman mythology. It may be also be based on Kabandha, a demon from Hindu Mythology. Its name is derived from actor and martial artist Bruce Lee."
107,Hitmonchan,Ebiwarā (エビワラー),Fighting,,End of evolution,Its name is derived from actor and martial artist Jackie Chan.
108,Lickitung,Beroringa (ベロリンガ),Normal,,Lickilicky (#463),"It can swiftly pick up a small bean with its tongue better than its hands or feet. If it licks you and you don't clean it off, it'll break out into a rash."
109,Koffing,Dogāsu (ドガース),Poison,,Weezing (#110),Koffing is based on air pollution.
110,Weezing,Matadogasu (マタドガス),Poison,,End of evolution,A Weezing belonged to James of Team Rocket in the Kanto and Johto series of the Pokémon anime and for a small portion of the Advanced Generation series.
111,Rhyhorn,Saihōn (サイホーン),Ground,Rock,Rhydon (#112),"Its tackles can demolish skyscrapers but its memory isn't the best. Once it starts going, it can't remember why it started."
112,Rhydon,Saidon (サイドン),Ground,Rock,Rhyperior (#464),Rhydon was the first Pokémon created by Game Freak.[35]
113,Chansey,Rakkī (ラッキー),Normal,,Blissey (#242),"In generation II, Blissey (#242) was added and in generation IV Happiny (#440) was added. Initially however, Chansey was a single staged Pokémon."
114,Tangela,Monjara (モンジャラ),Grass,,Tangrowth (#465),
115,Kangaskhan,Garūra (ガルーラ),Normal,,Mega Evolution,"In Pokémon Go, Kangaskhan is exclusively found in Australia."
116,Horsea,Tattsū (タッツー),Water,,Seadra (#117),Horsea and Seadra are based on seahorses.[36]
117,Seadra,Shīdora (シードラ),Water,,Kingdra (#230),
118,Goldeen,Tosakinto (トサキント),Water,,Seaking (#119),Goldeen and Seaking are based on goldfish.[36]
119,Seaking,Azumaō (アズマオウ),Water,,End of evolution,
120,Staryu,Hitodeman (ヒトデマン),Water,,Starmie (#121),"Staryu, known as the Star Shape Pokémon, is a basic, Water-type Pokémon which resembles a starfish."
121,Starmie,Sutāmī (スターミー),Water,Psychic,End of evolution,"Starmie, known as the Mysterious Pokémon, resembles a sea star. Starmie appears to have a second star growing on its back, which is semi-attached, being able to spin 360°. Starmie has a red jewel core, which resembles a cut precious stone and seems to shine with the seven colors of the rainbow when looked at from different angles,[37] but usually shows up red more than any other color. It can also emit electrical waves from the core that are powerful enough to reach the furthest parts of the universe.[38]"
122,Mr. Mime,Bariyādo (バリヤード),Psychic,Fairy[nb 5],End of evolution[nb 6],"Its pantomiming is the best in the world. If someone interrupts it, it will harshly slap whoever did it with its big, broad hands that can form invisible walls just by vibrating it fingertips."
123,Scyther,Sutoraiku (ストライク),Bug,Flying,Scizor (#212),"IGN and GamesRadar have praised Scyther's ""cool"" design.[39][40][41]"
124,Jynx,Rūjura (ルージュラ),Ice,Psychic,End of evolution,"Jynx has spawned controversy due to aspects of its design being similar to blackface, leading Game Freak to change the color of its skin from black to purple.[42][43][44][45][46] When Pokémon Yellow was re-released on the Nintendo 3DS Virtual Console, the in-game sprite of Jynx was edited to reflect this change.[46]"
125,Electabuzz,Erebū (エレブー),Electric,,Electivire (#466),"It gathers near power plants to feast on electricity. In the dark, it glows a whitish blue color."
126,Magmar,Būbā (ブーバー),Fire,,Magmortar (#467),"While Magmar was voted the eighth best fire-type Pokémon by the Official Nintendo Magazine readers,[47] GamesRadar has criticized its design multiple times, noting that its forehead resembles a butt.[48][49]"
127,Pinsir,Kairosu (カイロス),Bug,,Mega Evolution,It likes to throw things with its massive horns. It can throw things 2x its weight.
128,Tauros,Kentarosu (ケンタロス),Normal,,No evolution,It is voiced by Toshiyuki Morikawa in Pokémon X and Y - present.
129,Magikarp,Koikingu (コイキング),Water,,Gyarados (#130),"Magikarp holds the distinction of being mostly useless in the games, until it evolves into the superior Gyarados. Magikarp is based on the common carp.[36]"
130,Gyarados,Gyaradosu (ギャラドス),Water,Flying,Mega Evolution,"In the beta versions for Pokémon Red and Blue, Gyarados was originally named ""Skullkraken"". Gyarados is inspired by the myth of a carp jumping over the Dragon Gate. Its vicious and raging attitude can decimate cities."
131,Lapras,Rapurasu (ラプラス),Water,Ice,No evolution,[Gigantamax] Has a very gentle nature. Was hunted before it became illegal. Gigantamax Lapras is exclusive to Shield.
132,Ditto,Metamon (メタモン),Normal,,No evolution,"The favorite Pokémon of Hideo Kojima,[50] Ditto is capable of transforming into any Pokémon it comes across."
133,Eevee,Ībui (イーブイ),Normal,,Multiple[nb 7],"[Gigantamax] Eevee is often considered among the ""cutest"" Pokémon in the franchise.[51][52][53][54] Because of this, Eevee is featured on various Pokémon-related merchandise.[55][56][57] Mascot of Pokémon: Let's Go, Eevee!"
134,Vaporeon,Shawāzu (シャワーズ),Water,,End of Evolution,"When its in water, because its molecules are very similar to water, it will seem to invisibly melt in water."
135,Jolteon,Sandāsu (サンダース),Electric,,End of evolution,"Jolteon and Zapdos's romanized Japanese names are almost exactly the same as each other's, with a final's being the only difference."
136,Flareon,Būsutā (ブースター),Fire,,End of evolution,"Flareon shares its category name with Charmeleon, Charizard, Moltres, and Infernape. They are all known as the Flame Pokémon."
137,Porygon,Porigon (ポリゴン),Normal,,Porygon2 (#233),"Porygon has become notorious for being featured in an episode of the anime that caused widespread epileptic seizures in Japanese viewers.[58] It can be really helpful with scientists because since it can go in to cyberspace at will, it looks for malicious malware in computers."
138,Omanyte,Omunaito (オムナイト),Rock,Water,Omastar (#139),A fossil Pokémon that must be revived from the helix fossil.
139,Omastar,Omusutā (オムスター),Rock,Water,End of evolution,"Omastar is very popular in the community and commonly referred to as ""Lord Helix"". This is a reference to Twitch Plays Pokémon, where the Pokémon was seen as a good luck charm."
140,Kabuto,Kabuto (カブト),Rock,Water,Kabutops (#141),A fossil Pokémon that must be revived from the dome fossil.
141,Kabutops,Kabutopusu (カブトプス),Rock,Water,End of evolution,Its slender body makes it a very fast swimmer.
142,Aerodactyl,Putera (プテラ),Rock,Flying,Mega Evolution,A fossil Pokémon that must be revived from the old amber. It used to rule the skies back when it was alive. Now not even computers can't even revive it to make it what it used to look like.
143,Snorlax,Kabigon (カビゴン),Normal,,End of evolution,"[Gigantamax] It is carefree about everything and it will allow children to play on its vast belly while it sleeps all day. After eating around 500 pounds of food, it goes flat to sleep for awhile."
